headline,url
Apple stock in focus as CEO Tim Cook spooks with one phrase,https://finance.yahoo.com/news/apple-stock-tim-cook-economy-outlook-earnings-160945327.html
"Stocks moving in after-hours: Amazon, Alphabet, Apple",https://finance.yahoo.com/news/stocks-moving-in-after-hours-amazon-alphabet-apple-225318178.html
"Amazon earnings: AWS performance was the 'disappointment,' analyst says",https://finance.yahoo.com/video/amazon-earnings-aws-performance-disappointment-215121184.html
"Amazon reports mixed Q4 earnings, revenue beat",https://finance.yahoo.com/video/amazon-reports-q4-earnings-beat-211938642.html
"Amazon Cuts Back on Stores, But Still Wants to Sell You Groceries",https://finance.yahoo.com/m/cb69e65d-be83-3fd9-b0e4-26528767c2ea/amazon-cuts-back-on-stores-.html
"These Stocks Are Moving the Most Today: Amazon, Apple, Alphabet, Ford, Nordstrom, and More",https://finance.yahoo.com/m/ad903fb3-23fb-328c-a89f-55ab6dc2530e/these-stocks-are-moving-the.html
‘Patience will be rewarded’: Why Wall Street analysts aren’t freaking out over Amazon’s results and think shares are worth more,https://finance.yahoo.com/m/5fe2f68e-261e-3ea4-b8ae-011a285d90f3/%E2%80%98patience-will-be-rewarded%E2%80%99-.html
"Dow turns higher as stocks trim losses after blowout jobs report, disappointing corporate earnings",https://finance.yahoo.com/m/07ac723b-96cf-3083-af2c-4300c8a5e770/dow-turns-higher-as-stocks.html
FTC Is Preparing Potential Antitrust Case Against Amazon,https://finance.yahoo.com/news/ftc-preparing-potential-antitrust-case-161600595.html
